{
  "landing": {
    "title": "Amigo Secreto",
    "subtitle": "Organize sua troca de presentes com facilidade",
    "howItWorks": "Como funciona",
    "instructions": [
      "Crie um novo Amigo Secreto com os nomes dos participantes",
      "Defina uma semente aleat√≥ria para atribui√ß√µes reproduz√≠veis",
      "Compartilhe links individuais com cada participante",
      "Cada pessoa v√™ apenas quem ela vai presentear",
      "O administrador pode ver todas as atribui√ß√µes com a senha"
    ],
    "securityNoticeTitle": "üéÑ Feito para Jogadores Honestos",
    "securityNoticeText": "Este app funciona no sistema de honra! Os links s√£o codificados (n√£o criptografados), ent√£o √© ideal para grupos confi√°veis como fam√≠lia, amigos ou colegas. Se voc√™ precisa de seguran√ßa Fort Knox, este pode n√£o ser o seu app! üòä",
    "createButton": "Criar Novo Amigo Secreto",
    "viewButton": "Ver Sua Atribui√ß√£o"
  },
  "create": {
    "title": "Criar Amigo Secreto",
    "participantsLabel": "Nomes dos Participantes",
    "participantsHelp": "Digite um nome por linha (m√≠nimo 3, m√°ximo 50 participantes)",
    "participantsPlaceholder": "Alice\nBob\nCarlos\nDiana",
    "seedLabel": "Semente Aleat√≥ria",
    "seedHelp": "Uma semente aleat√≥ria foi gerada, ou voc√™ pode fornecer a sua pr√≥pria",
    "seedPlaceholder": "ex: natal2024",
    "passwordLabel": "Senha do Administrador",
    "passwordHelp": "Opcional - deixe em branco para nenhuma prote√ß√£o por senha",
    "passwordPlaceholder": "Digite a senha do administrador (opcional)",
    "backButton": "Voltar",
    "submitButton": "Gerar Amigo Secreto"
  },
  "results": {
    "title": "Amigo Secreto Criado!",
    "adminLinkTitle": "Link do Administrador",
    "adminLinkHelp": "Compartilhe isso com o organizador para ver todas as atribui√ß√µes",
    "participantLinksTitle": "Links dos Participantes",
    "participantLinksHelp": "Compartilhe cada link com o participante correspondente",
    "copyButton": "Copiar",
    "copiedButton": "‚úì Copiado!",
    "createAnotherButton": "Criar Outro"
  },
  "viewParticipant": {
    "title": "Sua Atribui√ß√£o de Amigo Secreto",
    "youAre": "Voc√™ √© o Amigo Secreto de:",
    "keepSecret": "ü§´ Mantenha em segredo!",
    "backButton": "Voltar ao In√≠cio"
  },
  "viewAdmin": {
    "title": "Vis√£o do Administrador",
    "participantLinksTitle": "Links dos Participantes",
    "participantLinksHelp": "Compartilhe estes links com os participantes se eles precisarem novamente",
    "passwordLabel": "Digite a Senha do Administrador",
    "passwordPlaceholder": "Senha do administrador",
    "unlockButton": "Ver Todas as Atribui√ß√µes",
    "incorrectPassword": "Senha incorreta",
    "allAssignmentsTitle": "Todas as Atribui√ß√µes do Amigo Secreto",
    "giverColumn": "Doador",
    "receiverColumn": "Receptor",
    "backButton": "Voltar ao In√≠cio"
  },
  "error": {
    "title": "‚ö†Ô∏è Erro",
    "backButton": "Voltar ao In√≠cio"
  },
  "validation": {
    "minParticipants": "Voc√™ precisa de pelo menos 3 participantes para o Amigo Secreto",
    "maxParticipants": "M√°ximo 50 participantes permitidos (limita√ß√£o de comprimento de URL)",
    "seedRequired": "Por favor, digite uma semente aleat√≥ria",
    "passwordRequired": "Por favor, digite uma senha de administrador",
    "passwordTooShort": "A senha do administrador deve ter pelo menos 4 caracteres",
    "noAssignmentFound": "Nenhuma atribui√ß√£o encontrada para {name}",
    "failedToLoad": "Falha ao carregar atribui√ß√£o: {error}",
    "failedToCreate": "Erro ao criar Amigo Secreto: {error}",
    "invalidUrl": "URL inv√°lido: par√¢metro de usu√°rio ou administrador ausente",
    "invalidData": "Formato de dados inv√°lido",
    "failedToCopy": "Falha ao copiar para a √°rea de transfer√™ncia"
  },
  "alerts": {
    "viewInstructions": "Para ver sua atribui√ß√£o, clique no link personalizado que foi compartilhado com voc√™."
  }
}
