{
  "landing": {
    "title": "NÃºra YÃ©ni Aran",
    "subtitle": "TecÃ« le mÃ­rieryassÃ« formiÃ«",
    "howItWorks": "Manen nÃ¡",
    "instructions": [
      "Cara NÃºra YÃ©ni Aran essenen i yomenin",
      "TecÃ« erdÃ« vilya an hrestallÃ« atarmi",
      "Anna sÃ­ thailÃ« ilya yÃ³menello",
      "Ilya indÃ³me cenÃ« ta yÃ³men anna dan",
      "Aran cenÃ« ilya atarmi as tÃªw"
    ],
    "securityNoticeTitle": "ğŸ„ Faila Yomenin Ã¡ CarÃ«",
    "securityNoticeText": "Sin apsenÃ« apsenÃ¡ fairÃ«o! I thailÃ« apsÃ©near, lÃ¡ sangiÃ©nar - mÃ¡ra nostalÃ« atariÃ©nen, meldin, ar yomenniÃ©nen! Man mÃ©rÃ« Fort Knox limbÃ«? Ãš-mÃ¡ra sin apsenÃ«! ğŸ˜Š",
    "createButton": "Cara NÃºra YÃ©ni Aran",
    "viewButton": "Cen Le AtarmÃ«"
  },
  "create": {
    "title": "Cara NÃºra YÃ©ni Aran",
    "participantsLabel": "EssÃ« i Yomenin",
    "participantsHelp": "TecÃ« min essÃ« sÃ­men lÃ­nÃ« (neldÃ« yÃ³menin nÃ©, lempÃ« yÃ³menin)",
    "participantsPlaceholder": "Galadriel\nElrond\nArwen\nCeleborn",
    "seedLabel": "ErdÃ« Vilya",
    "seedHelp": "A random seed has been generated, or provide your own",
    "seedPlaceholder": "e.g., yestarÃ«2024",
    "passwordLabel": "Aran TÃªw",
    "passwordHelp": "Optional - leave blank for no password protection",
    "passwordPlaceholder": "Enter admin password (optional)",
    "backButton": "Nat",
    "submitButton": "ApsÃ« NÃºra YÃ©ni Aran"
  },
  "results": {
    "title": "NÃºra YÃ©ni Aran CarnÃ«!",
    "adminLinkTitle": "Aran ThailÃ«",
    "adminLinkHelp": "Anna ta i turÃ« an cen ilya atarmi",
    "participantLinksTitle": "YÃ³men Thailen",
    "participantLinksHelp": "Anna ilya thailÃ« i yÃ³menin",
    "copyButton": "TecÃ«",
    "copiedButton": "âœ“ TecnÃ«!",
    "createAnotherButton": "Cara AnwÃ«"
  },
  "viewParticipant": {
    "title": "Le AtarmÃ« NÃºra YÃ©ni Aran",
    "youAre": "NÃ¡ NÃºra YÃ©ni Aran an:",
    "keepSecret": "ğŸ¤« Pol i nÃºrÃ«!",
    "backButton": "Nat Arwa"
  },
  "viewAdmin": {
    "title": "Aran CentiÃ«",
    "participantLinksTitle": "YÃ³men Thailen",
    "participantLinksHelp": "Anna sin thaile i yomenin man mÃ©riÃ«r nat",
    "passwordLabel": "TecÃ« Aran TÃªw",
    "passwordPlaceholder": "Aran tÃªw",
    "unlockButton": "Cen Ilya Atarmi",
    "incorrectPassword": "TÃªw Ãº-faila",
    "allAssignmentsTitle": "Ilya Atarmi NÃºra YÃ©ni Aran",
    "giverColumn": "Anna",
    "receiverColumn": "CÃ¡pa",
    "backButton": "Nat Arwa"
  },
  "error": {
    "title": "âš ï¸ Ãš-faila",
    "backButton": "Nat Arwa"
  },
  "validation": {
    "minParticipants": "PolduvÃ« neldÃ« yÃ³menin NÃºra YÃ©ni Aran",
    "maxParticipants": "LempÃ« yÃ³menin polduvar (thailÃ« andavÃ«)",
    "seedRequired": "TecÃ« erdÃ« vilya",
    "passwordRequired": "TecÃ« aran tÃªw",
    "passwordTooShort": "Aran tÃªw polda canta tengwi",
    "noAssignmentFound": "AtarmÃ« {name} Ãº-hirnÃ«",
    "failedToLoad": "Ãš-hirnÃ« atarmÃ«: {error}",
    "failedToCreate": "Ãš-faila carÃ« NÃºra YÃ©ni Aran: {error}",
    "invalidUrl": "ThailÃ« Ãº-faila: yÃ³men ephÃ« aran Ãº-hirnÃ«",
    "invalidData": "Sanya Ãº-faila",
    "failedToCopy": "Ãš-tecÃ«"
  },
  "alerts": {
    "viewInstructions": "An cen le atarmÃ«, mapÃ« i thailÃ« sinyanna i annÃ« le."
  }
}
