{
  "landing": {
    "title": "Amigo Invisible",
    "subtitle": "Organiza tu intercambio de regalos con facilidad",
    "howItWorks": "C√≥mo funciona",
    "instructions": [
      "Crea un nuevo Amigo Invisible con los nombres de los participantes",
      "Establece una semilla aleatoria para asignaciones reproducibles",
      "Comparte enlaces individuales con cada participante",
      "Cada persona solo ve a qui√©n le toca dar",
      "El administrador puede ver todas las asignaciones con contrase√±a"
    ],
    "securityNoticeTitle": "üéÑ Para Jugadores Justos",
    "securityNoticeText": "¬°Esta app funciona con el sistema de honor! Los enlaces est√°n codificados (no encriptados), as√≠ que es ideal para grupos de confianza como familia, amigos o compa√±eros. Si necesitas seguridad de Fort Knox, ¬°puede que esta no sea tu app! üòä",
    "createButton": "Crear Nuevo Amigo Invisible",
    "viewButton": "Ver Tu Asignaci√≥n"
  },
  "create": {
    "title": "Crear Amigo Invisible",
    "participantsLabel": "Nombres de los Participantes",
    "participantsHelp": "Ingresa un nombre por l√≠nea (m√≠nimo 3, m√°ximo 50 participantes)",
    "participantsPlaceholder": "Alicia\nBob\nCarlos\nDiana",
    "seedLabel": "Semilla Aleatoria",
    "seedHelp": "Se ha generado una semilla aleatoria, o puede proporcionar la suya propia",
    "seedPlaceholder": "ej: navidad2024",
    "passwordLabel": "Contrase√±a de Administrador",
    "passwordHelp": "Opcional - dejar en blanco para ninguna protecci√≥n con contrase√±a",
    "passwordPlaceholder": "Ingrese la contrase√±a de administrador (opcional)",
    "backButton": "Atr√°s",
    "submitButton": "Generar Amigo Invisible"
  },
  "results": {
    "title": "¬°Amigo Invisible Creado!",
    "adminLinkTitle": "Enlace de Administrador",
    "adminLinkHelp": "Comparte esto con el organizador para ver todas las asignaciones",
    "participantLinksTitle": "Enlaces de Participantes",
    "participantLinksHelp": "Comparte cada enlace con el participante correspondiente",
    "copyButton": "Copiar",
    "copiedButton": "‚úì ¬°Copiado!",
    "createAnotherButton": "Crear Otro"
  },
  "viewParticipant": {
    "title": "Tu Asignaci√≥n de Amigo Invisible",
    "youAre": "Eres el Amigo Invisible de:",
    "keepSecret": "ü§´ ¬°Mant√©nlo en secreto!",
    "backButton": "Volver al Inicio"
  },
  "viewAdmin": {
    "title": "Vista de Administrador",
    "participantLinksTitle": "Enlaces de Participantes",
    "participantLinksHelp": "Comparte estos enlaces con los participantes si los necesitan",
    "passwordLabel": "Ingresa la Contrase√±a de Administrador",
    "passwordPlaceholder": "Contrase√±a de administrador",
    "unlockButton": "Ver Todas las Asignaciones",
    "incorrectPassword": "Contrase√±a incorrecta",
    "allAssignmentsTitle": "Todas las Asignaciones del Amigo Invisible",
    "giverColumn": "Donante",
    "receiverColumn": "Receptor",
    "backButton": "Volver al Inicio"
  },
  "error": {
    "title": "‚ö†Ô∏è Error",
    "backButton": "Volver al Inicio"
  },
  "validation": {
    "minParticipants": "Necesitas al menos 3 participantes para el Amigo Invisible",
    "maxParticipants": "M√°ximo 50 participantes permitidos (limitaci√≥n de longitud de URL)",
    "seedRequired": "Por favor ingresa una semilla aleatoria",
    "passwordRequired": "Por favor ingresa una contrase√±a de administrador",
    "passwordTooShort": "La contrase√±a de administrador debe tener al menos 4 caracteres",
    "noAssignmentFound": "No se encontr√≥ asignaci√≥n para {name}",
    "failedToLoad": "Error al cargar la asignaci√≥n: {error}",
    "failedToCreate": "Error al crear el Amigo Invisible: {error}",
    "invalidUrl": "URL inv√°lida: falta el par√°metro de usuario o administrador",
    "invalidData": "Formato de datos inv√°lido",
    "failedToCopy": "Error al copiar al portapapeles"
  },
  "alerts": {
    "viewInstructions": "Para ver tu asignaci√≥n, haz clic en el enlace personalizado que se comparti√≥ contigo."
  }
}
