{
  "landing": {
    "title": "Tajemniczy MikoÅ‚aj",
    "subtitle": "Zorganizuj wymianÄ™ prezentÃ³w z Å‚atwoÅ›ciÄ…",
    "howItWorks": "Jak to dziaÅ‚a",
    "instructions": [
      "UtwÃ³rz nowego Tajemniczego MikoÅ‚aja z nazwami uczestnikÃ³w",
      "Ustaw losowe ziarno dla powtarzalnych przypisaÅ„",
      "UdostÄ™pnij indywidualne linki kaÅ¼demu uczestnikowi",
      "KaÅ¼da osoba widzi tylko kogo obdarowuje",
      "Administrator moÅ¼e zobaczyÄ‡ wszystkie przypisania z hasÅ‚em"
    ],
    "securityNoticeTitle": "ğŸ„ Stworzone dla Uczciwych Graczy",
    "securityNoticeText": "Ta aplikacja dziaÅ‚a na zasadzie zaufania! Linki sÄ… zakodowane (nie zaszyfrowane), wiÄ™c idealnie nadaje siÄ™ dla zaufanych grup takich jak rodzina, przyjaciele czy wspÃ³Å‚pracownicy. JeÅ›li potrzebujesz bezpieczeÅ„stwa Fort Knox, to moÅ¼e nie byÄ‡ Twoja aplikacja! ğŸ˜Š",
    "createButton": "UtwÃ³rz Nowego Tajemniczego MikoÅ‚aja",
    "viewButton": "Zobacz Swoje Przypisanie"
  },
  "create": {
    "title": "UtwÃ³rz Tajemniczego MikoÅ‚aja",
    "participantsLabel": "Nazwy UczestnikÃ³w",
    "participantsHelp": "WprowadÅº jedno nazwisko w linii (minimum 3, maksimum 50 uczestnikÃ³w)",
    "participantsPlaceholder": "Alicja\nBob\nKarol\nDiana",
    "seedLabel": "Losowe Ziarno",
    "seedHelp": "UÅ¼yj tego samego ziarna, aby uzyskaÄ‡ te same przypisania",
    "seedPlaceholder": "np: bozenarodzenie2024",
    "passwordLabel": "HasÅ‚o Administratora",
    "passwordHelp": "Wymagane do zobaczenia wszystkich przypisaÅ„",
    "passwordPlaceholder": "WprowadÅº hasÅ‚o administratora",
    "backButton": "Wstecz",
    "submitButton": "Generuj Tajemniczego MikoÅ‚aja"
  },
  "results": {
    "title": "Tajemniczy MikoÅ‚aj Utworzony!",
    "adminLinkTitle": "Link Administratora",
    "adminLinkHelp": "UdostÄ™pnij to organizatorowi, aby zobaczyÄ‡ wszystkie przypisania",
    "participantLinksTitle": "Linki UczestnikÃ³w",
    "participantLinksHelp": "UdostÄ™pnij kaÅ¼dy link odpowiedniemu uczestnikowi",
    "copyButton": "Kopiuj",
    "copiedButton": "âœ“ Skopiowano!",
    "createAnotherButton": "UtwÃ³rz Kolejnego"
  },
  "viewParticipant": {
    "title": "Twoje Przypisanie Tajemniczego MikoÅ‚aja",
    "youAre": "JesteÅ› Tajemniczym MikoÅ‚ajem dla:",
    "keepSecret": "ğŸ¤« Zachowaj to w tajemnicy!",
    "backButton": "PowrÃ³t do Strony GÅ‚Ã³wnej"
  },
  "viewAdmin": {
    "title": "Widok Administratora",
    "participantLinksTitle": "Linki UczestnikÃ³w",
    "participantLinksHelp": "UdostÄ™pnij te linki uczestnikom, jeÅ›li bÄ™dÄ… ich ponownie potrzebowaÄ‡",
    "passwordLabel": "WprowadÅº HasÅ‚o Administratora",
    "passwordPlaceholder": "HasÅ‚o administratora",
    "unlockButton": "Zobacz Wszystkie Przypisania",
    "incorrectPassword": "NieprawidÅ‚owe hasÅ‚o",
    "allAssignmentsTitle": "Wszystkie Przypisania Tajemniczego MikoÅ‚aja",
    "giverColumn": "ObdarowujÄ…cy",
    "receiverColumn": "Obdarowany",
    "backButton": "PowrÃ³t do Strony GÅ‚Ã³wnej"
  },
  "error": {
    "title": "âš ï¸ BÅ‚Ä…d",
    "backButton": "PowrÃ³t do Strony GÅ‚Ã³wnej"
  },
  "validation": {
    "minParticipants": "Potrzebujesz co najmniej 3 uczestnikÃ³w dla Tajemniczego MikoÅ‚aja",
    "maxParticipants": "Maksymalnie 50 uczestnikÃ³w dozwolonych (ograniczenie dÅ‚ugoÅ›ci URL)",
    "seedRequired": "ProszÄ™ wprowadziÄ‡ losowe ziarno",
    "passwordRequired": "ProszÄ™ wprowadziÄ‡ hasÅ‚o administratora",
    "passwordTooShort": "HasÅ‚o administratora musi mieÄ‡ co najmniej 4 znaki",
    "noAssignmentFound": "Nie znaleziono przypisania dla {name}",
    "failedToLoad": "Nie udaÅ‚o siÄ™ zaÅ‚adowaÄ‡ przypisania: {error}",
    "failedToCreate": "BÅ‚Ä…d podczas tworzenia Tajemniczego MikoÅ‚aja: {error}",
    "invalidUrl": "NieprawidÅ‚owy URL: brak parametru uÅ¼ytkownika lub administratora",
    "invalidData": "NieprawidÅ‚owy format danych",
    "failedToCopy": "Nie udaÅ‚o siÄ™ skopiowaÄ‡ do schowka"
  },
  "alerts": {
    "viewInstructions": "Aby zobaczyÄ‡ swoje przypisanie, kliknij na spersonalizowany link, ktÃ³ry zostaÅ‚ Ci udostÄ™pniony."
  }
}
