{
  "landing": {
    "title": "ç¥ç§˜åœ£è¯è€äºº",
    "subtitle": "è½»æ¾ç»„ç»‡ç¤¼ç‰©äº¤æ¢",
    "howItWorks": "å¦‚ä½•è¿ä½œ",
    "instructions": [
      "ä½¿ç”¨å‚ä¸è€…å§“ååˆ›å»ºæ–°çš„ç¥ç§˜åœ£è¯è€äºº",
      "è®¾ç½®éšæœºç§å­ä»¥è·å¾—å¯é‡ç°çš„åˆ†é…",
      "ä¸æ¯ä¸ªå‚ä¸è€…åˆ†äº«ä¸ªäººé“¾æ¥",
      "æ¯ä¸ªäººåªèƒ½çœ‹åˆ°ä»–ä»¬è¦é€ç¤¼çš„å¯¹è±¡",
      "ç®¡ç†å‘˜å¯ä»¥ä½¿ç”¨å¯†ç æŸ¥çœ‹æ‰€æœ‰åˆ†é…"
    ],
    "securityNoticeTitle": "ğŸ„ ä¸ºè¯šä¿¡ç©å®¶è€Œè®¾",
    "securityNoticeText": "æ­¤åº”ç”¨åŸºäºè£èª‰ç³»ç»Ÿè¿ä½œï¼é“¾æ¥å·²ç¼–ç ï¼ˆæœªåŠ å¯†ï¼‰ï¼Œå› æ­¤æœ€é€‚åˆå®¶äººã€æœ‹å‹æˆ–åŒäº‹ç­‰å€¼å¾—ä¿¡èµ–çš„ç¾¤ä½“ã€‚å¦‚æœæ‚¨éœ€è¦è¯ºå…‹æ–¯å ¡çº§åˆ«çš„å®‰å…¨æ€§ï¼Œè¿™å¯èƒ½ä¸æ˜¯æ‚¨çš„åº”ç”¨ï¼ğŸ˜Š",
    "createButton": "åˆ›å»ºæ–°çš„ç¥ç§˜åœ£è¯è€äºº",
    "viewButton": "æŸ¥çœ‹æ‚¨çš„åˆ†é…"
  },
  "create": {
    "title": "åˆ›å»ºç¥ç§˜åœ£è¯è€äºº",
    "participantsLabel": "å‚ä¸è€…å§“å",
    "participantsHelp": "æ¯è¡Œè¾“å…¥ä¸€ä¸ªåå­—ï¼ˆæœ€å°‘3äººï¼Œæœ€å¤š50äººï¼‰",
    "participantsPlaceholder": "çˆ±ä¸½ä¸\né²å‹ƒ\næŸ¥ç†\næˆ´å®‰å¨œ",
    "seedLabel": "éšæœºç§å­",
    "seedHelp": "å·²ç”Ÿæˆéšæœºç§å­ï¼Œæˆ–è€…æ‚¨å¯ä»¥æä¾›è‡ªå·±çš„ç§å­",
    "seedPlaceholder": "ä¾‹å¦‚ï¼šåœ£è¯èŠ‚2024",
    "passwordLabel": "ç®¡ç†å‘˜å¯†ç ",
    "passwordHelp": "å¯é€‰ - ç•™ç©ºè¡¨ç¤ºæ— å¯†ç ä¿æŠ¤",
    "passwordPlaceholder": "è¾“å…¥ç®¡ç†å‘˜å¯†ç ï¼ˆå¯é€‰ï¼‰",
    "backButton": "è¿”å›",
    "submitButton": "ç”Ÿæˆç¥ç§˜åœ£è¯è€äºº"
  },
  "results": {
    "title": "ç¥ç§˜åœ£è¯è€äººå·²åˆ›å»ºï¼",
    "adminLinkTitle": "ç®¡ç†å‘˜é“¾æ¥",
    "adminLinkHelp": "ä¸ç»„ç»‡è€…åˆ†äº«æ­¤é“¾æ¥ä»¥æŸ¥çœ‹æ‰€æœ‰åˆ†é…",
    "participantLinksTitle": "å‚ä¸è€…é“¾æ¥",
    "participantLinksHelp": "ä¸ç›¸åº”å‚ä¸è€…åˆ†äº«æ¯ä¸ªé“¾æ¥",
    "copyButton": "å¤åˆ¶",
    "copiedButton": "âœ“ å·²å¤åˆ¶ï¼",
    "createAnotherButton": "åˆ›å»ºå¦ä¸€ä¸ª"
  },
  "viewParticipant": {
    "title": "æ‚¨çš„ç¥ç§˜åœ£è¯è€äººåˆ†é…",
    "youAre": "æ‚¨æ˜¯ä»¥ä¸‹äººå‘˜çš„ç¥ç§˜åœ£è¯è€äººï¼š",
    "keepSecret": "ğŸ¤« ä¿å®ˆç§˜å¯†ï¼",
    "backButton": "è¿”å›ä¸»é¡µ"
  },
  "viewAdmin": {
    "title": "ç®¡ç†å‘˜è§†å›¾",
    "participantLinksTitle": "å‚ä¸è€…é“¾æ¥",
    "participantLinksHelp": "å¦‚éœ€è¦è¯·ä¸å‚ä¸è€…åˆ†äº«è¿™äº›é“¾æ¥",
    "passwordLabel": "è¾“å…¥ç®¡ç†å‘˜å¯†ç ",
    "passwordPlaceholder": "ç®¡ç†å‘˜å¯†ç ",
    "unlockButton": "æŸ¥çœ‹æ‰€æœ‰åˆ†é…",
    "incorrectPassword": "å¯†ç é”™è¯¯",
    "allAssignmentsTitle": "æ‰€æœ‰ç¥ç§˜åœ£è¯è€äººåˆ†é…",
    "giverColumn": "é€ç¤¼è€…",
    "receiverColumn": "æ¥æ”¶è€…",
    "backButton": "è¿”å›ä¸»é¡µ"
  },
  "error": {
    "title": "âš ï¸ é”™è¯¯",
    "backButton": "è¿”å›ä¸»é¡µ"
  },
  "validation": {
    "minParticipants": "ç¥ç§˜åœ£è¯è€äººè‡³å°‘éœ€è¦3åå‚ä¸è€…",
    "maxParticipants": "æœ€å¤šå…è®¸50åå‚ä¸è€…ï¼ˆURLé•¿åº¦é™åˆ¶ï¼‰",
    "seedRequired": "è¯·è¾“å…¥éšæœºç§å­",
    "passwordRequired": "è¯·è¾“å…¥ç®¡ç†å‘˜å¯†ç ",
    "passwordTooShort": "ç®¡ç†å‘˜å¯†ç å¿…é¡»è‡³å°‘4ä¸ªå­—ç¬¦",
    "noAssignmentFound": "æœªæ‰¾åˆ°{name}çš„åˆ†é…",
    "failedToLoad": "åŠ è½½åˆ†é…å¤±è´¥ï¼š{error}",
    "failedToCreate": "åˆ›å»ºç¥ç§˜åœ£è¯è€äººæ—¶å‡ºé”™ï¼š{error}",
    "invalidUrl": "æ— æ•ˆURLï¼šç¼ºå°‘ç”¨æˆ·æˆ–ç®¡ç†å‘˜å‚æ•°",
    "invalidData": "æ— æ•ˆæ•°æ®æ ¼å¼",
    "failedToCopy": "å¤åˆ¶åˆ°å‰ªè´´æ¿å¤±è´¥"
  },
  "alerts": {
    "viewInstructions": "è¦æŸ¥çœ‹æ‚¨çš„åˆ†é…ï¼Œè¯·ç‚¹å‡»ä¸æ‚¨åˆ†äº«çš„ä¸ªäººé“¾æ¥ã€‚"
  }
}
