{
  "landing": {
    "title": "PÃ¨re NoÃ«l Secret",
    "subtitle": "Organisez votre Ã©change de cadeaux en toute simplicitÃ©",
    "howItWorks": "Comment Ã§a marche",
    "instructions": [
      "CrÃ©ez un nouveau PÃ¨re NoÃ«l Secret avec les noms des participants",
      "DÃ©finissez une graine alÃ©atoire pour des attributions reproductibles",
      "Partagez les liens individuels avec chaque participant",
      "Chaque personne ne voit que son attribution",
      "L'administrateur peut voir toutes les attributions avec le mot de passe"
    ],
    "securityNoticeTitle": "ğŸ„ Pour Joueurs Fair-Play",
    "securityNoticeText": "Cette application fonctionne sur le principe de l'honneur ! Les liens sont encodÃ©s (pas chiffrÃ©s), donc c'est idÃ©al pour des groupes de confiance comme la famille, les amis ou les collÃ¨gues. Si vous avez besoin d'une sÃ©curitÃ© maximale, ce n'est peut-Ãªtre pas l'app qu'il vous faut ! ğŸ˜Š",
    "createButton": "CrÃ©er un PÃ¨re NoÃ«l Secret",
    "viewButton": "Voir Votre Attribution"
  },
  "create": {
    "title": "CrÃ©er un PÃ¨re NoÃ«l Secret",
    "participantsLabel": "Noms des Participants",
    "participantsHelp": "Entrez un nom par ligne (minimum 3, maximum 50 participants)",
    "participantsPlaceholder": "Alice\nBob\nCharlie\nDiana",
    "seedLabel": "Graine AlÃ©atoire",
    "seedHelp": "Une graine alÃ©atoire a Ã©tÃ© gÃ©nÃ©rÃ©e, ou vous pouvez fournir la vÃ´tre",
    "seedPlaceholder": "ex: noel2024",
    "passwordLabel": "Mot de Passe Administrateur",
    "passwordHelp": "Optionnel - laissez vide pour aucune protection par mot de passe",
    "passwordPlaceholder": "Entrez le mot de passe administrateur (optionnel)",
    "backButton": "Retour",
    "submitButton": "GÃ©nÃ©rer le PÃ¨re NoÃ«l Secret"
  },
  "results": {
    "title": "PÃ¨re NoÃ«l Secret CrÃ©Ã© !",
    "adminLinkTitle": "Lien Administrateur",
    "adminLinkHelp": "Partagez ce lien avec l'organisateur pour voir toutes les attributions",
    "participantLinksTitle": "Liens des Participants",
    "participantLinksHelp": "Partagez chaque lien avec le participant correspondant",
    "copyButton": "Copier",
    "copiedButton": "âœ“ CopiÃ© !",
    "createAnotherButton": "CrÃ©er un Autre"
  },
  "viewParticipant": {
    "title": "Votre Attribution de PÃ¨re NoÃ«l Secret",
    "youAre": "Vous Ãªtes le PÃ¨re NoÃ«l Secret de :",
    "keepSecret": "ğŸ¤« Gardez le secret !",
    "backButton": "Retour Ã  l'Accueil"
  },
  "viewAdmin": {
    "title": "Vue Administrateur",
    "participantLinksTitle": "Liens des Participants",
    "participantLinksHelp": "Partagez ces liens avec les participants s'ils en ont besoin",
    "passwordLabel": "Entrez le Mot de Passe Administrateur",
    "passwordPlaceholder": "Mot de passe administrateur",
    "unlockButton": "Voir Toutes les Attributions",
    "incorrectPassword": "Mot de passe incorrect",
    "allAssignmentsTitle": "Toutes les Attributions du PÃ¨re NoÃ«l Secret",
    "giverColumn": "Donneur",
    "receiverColumn": "Receveur",
    "backButton": "Retour Ã  l'Accueil"
  },
  "error": {
    "title": "âš ï¸ Erreur",
    "backButton": "Retour Ã  l'Accueil"
  },
  "validation": {
    "minParticipants": "Vous avez besoin d'au moins 3 participants pour le PÃ¨re NoÃ«l Secret",
    "maxParticipants": "Maximum 50 participants autorisÃ©s (limitation de longueur d'URL)",
    "seedRequired": "Veuillez entrer une graine alÃ©atoire",
    "passwordRequired": "Veuillez entrer un mot de passe administrateur",
    "passwordTooShort": "Le mot de passe administrateur doit contenir au moins 4 caractÃ¨res",
    "noAssignmentFound": "Aucune attribution trouvÃ©e pour {name}",
    "failedToLoad": "Ã‰chec du chargement de l'attribution : {error}",
    "failedToCreate": "Erreur lors de la crÃ©ation du PÃ¨re NoÃ«l Secret : {error}",
    "invalidUrl": "URL invalide : paramÃ¨tre utilisateur ou administrateur manquant",
    "invalidData": "Format de donnÃ©es invalide",
    "failedToCopy": "Ã‰chec de la copie dans le presse-papiers"
  },
  "alerts": {
    "viewInstructions": "Pour voir votre attribution, cliquez sur le lien personnalisÃ© qui vous a Ã©tÃ© partagÃ©."
  }
}
