{
  "landing": {
    "title": "Amigo Invisible",
    "subtitle": "Organiza o teu intercambio de agasallos con facilidade",
    "howItWorks": "Como funciona",
    "instructions": [
      "Crea un novo Amigo Invisible cos nomes dos participantes",
      "Establece unha semente aleatoria para asignaci√≥ns reproducibles",
      "Comparte ligaz√≥ns individuais con cada participante",
      "Cada persoa s√≥ ve a quen lle toca agasallar",
      "O administrador pode ver todas as asignaci√≥ns co contrasinal"
    ],
    "securityNoticeTitle": "üéÑ Feito para Xogadores Honestos",
    "securityNoticeText": "Esta app funciona co sistema da honra! As ligaz√≥ns est√°n codificadas (non cifradas), polo que √© ideal para grupos de confianza como familia, amigos ou compa√±eiros. Se necesitas seguridade de Fort Knox, esta pode non ser a t√∫a app! üòä",
    "createButton": "Crear Novo Amigo Invisible",
    "viewButton": "Ver a T√∫a Asignaci√≥n"
  },
  "create": {
    "title": "Crear Amigo Invisible",
    "participantsLabel": "Nomes dos Participantes",
    "participantsHelp": "Introduce un nome por li√±a (m√≠nimo 3, m√°ximo 50 participantes)",
    "participantsPlaceholder": "Alicia\nBob\nCarlos\nDiana",
    "seedLabel": "Semente Aleatoria",
    "seedHelp": "Xerouse unha semente aleatoria, ou pode proporcionar a s√∫a propia",
    "seedPlaceholder": "ex: nadal2024",
    "passwordLabel": "Contrasinal de Administrador",
    "passwordHelp": "Opcional - deixar en branco para ningunha protecci√≥n con contrasinal",
    "passwordPlaceholder": "Introduce o contrasinal de administrador (opcional)",
    "backButton": "Atr√°s",
    "submitButton": "Xerar Amigo Invisible"
  },
  "results": {
    "title": "Amigo Invisible Creado!",
    "adminLinkTitle": "Ligaz√≥n de Administrador",
    "adminLinkHelp": "Comparte isto co organizador para ver todas as asignaci√≥ns",
    "participantLinksTitle": "Ligaz√≥ns dos Participantes",
    "participantLinksHelp": "Comparte cada ligaz√≥n co participante correspondente",
    "copyButton": "Copiar",
    "copiedButton": "‚úì Copiado!",
    "createAnotherButton": "Crear Outro"
  },
  "viewParticipant": {
    "title": "A T√∫a Asignaci√≥n de Amigo Invisible",
    "youAre": "Es o Amigo Invisible de:",
    "keepSecret": "ü§´ Mant√©n o segredo!",
    "backButton": "Volver ao Inicio"
  },
  "viewAdmin": {
    "title": "Vista de Administrador",
    "participantLinksTitle": "Ligaz√≥ns dos Participantes",
    "participantLinksHelp": "Comparte estas ligaz√≥ns cos participantes se as necesitan de novo",
    "passwordLabel": "Introduce o Contrasinal de Administrador",
    "passwordPlaceholder": "Contrasinal de administrador",
    "unlockButton": "Ver Todas as Asignaci√≥ns",
    "incorrectPassword": "Contrasinal incorrecto",
    "allAssignmentsTitle": "Todas as Asignaci√≥ns do Amigo Invisible",
    "giverColumn": "Dador",
    "receiverColumn": "Receptor",
    "backButton": "Volver ao Inicio"
  },
  "error": {
    "title": "‚ö†Ô∏è Erro",
    "backButton": "Volver ao Inicio"
  },
  "validation": {
    "minParticipants": "Necesitas polo menos 3 participantes para o Amigo Invisible",
    "maxParticipants": "M√°ximo 50 participantes permitidos (limitaci√≥n de lonxitude de URL)",
    "seedRequired": "Por favor, introduce unha semente aleatoria",
    "passwordRequired": "Por favor, introduce un contrasinal de administrador",
    "passwordTooShort": "O contrasinal de administrador debe ter polo menos 4 caracteres",
    "noAssignmentFound": "Non se atopou asignaci√≥n para {name}",
    "failedToLoad": "Erro ao cargar a asignaci√≥n: {error}",
    "failedToCreate": "Erro ao crear o Amigo Invisible: {error}",
    "invalidUrl": "URL non v√°lido: falta o par√°metro de usuario ou administrador",
    "invalidData": "Formato de datos non v√°lido",
    "failedToCopy": "Erro ao copiar ao portapapeis"
  },
  "alerts": {
    "viewInstructions": "Para ver a t√∫a asignaci√≥n, fai clic na ligaz√≥n personalizada que se compartiu contigo."
  }
}
