{
  "landing": {
    "title": "Thurin MÃ­rdan",
    "subtitle": "Orthach le megalad mellyn",
    "howItWorks": "Man cared",
    "instructions": [
      "Ego Thurin MÃ­rdan guren ah ennyn i mellyn",
      "Togo had annui an haded anglennatha",
      "Anno enni mellon ah i thailen annui",
      "Sui mellon cÃªn anno hen i anno dan",
      "Condir cÃªn gwenn hain haded le tÃªw"
    ],
    "securityNoticeTitle": "ğŸ„ An mellyn ceredir egor",
    "securityNoticeTitle": "ğŸ„ An Mellyn Faer Egor",
    "securityNoticeText": "I sad hen gÃ»r mÃ­riel! I thailen egorer, Ãº-galadhremmo - mae an mellyn ceredir, velethril, ah mellon-gwaith! Man anÃ­rach galadh Fort Knox? Ãš-mae i sad hen! ğŸ˜Š",
    "createButton": "Ego Thurin MÃ­rdan Guren",
    "viewButton": "Pedo Had Le"
  },
  "create": {
    "title": "Ego Thurin MÃ­rdan",
    "participantsLabel": "Enni i Mellyn",
    "participantsHelp": "Tecco eneth sui thÃ¢l (nelui mellyn ned, canad mellyn ned)",
    "participantsPlaceholder": "Arwen\nLegolas\nGaladriel\nElrond",
    "seedLabel": "Had Annui",
    "seedHelp": "Togo i had him an i haded anglennatha him",
    "seedPlaceholder": "e.g., yestarÃ«2024",
    "passwordLabel": "TÃªw i Condir",
    "passwordHelp": "Orthach an hain haded gwenn",
    "passwordPlaceholder": "Tecco tÃªw i condir",
    "backButton": "Ego Ned",
    "submitButton": "Egor Thurin MÃ­rdan"
  },
  "results": {
    "title": "Thurin MÃ­rdan Egor!",
    "adminLinkTitle": "Thail i Condir",
    "adminLinkHelp": "Anno hen an i tÃ»r an hain haded gwenn",
    "participantLinksTitle": "Thailen i Mellyn",
    "participantLinksHelp": "Anno sui thail an mellon sui",
    "copyButton": "Togo",
    "copiedButton": "âœ“ Tegol!",
    "createAnotherButton": "Egor Eneth"
  },
  "viewParticipant": {
    "title": "Le Had Thurin MÃ­rdan",
    "youAre": "Thurin MÃ­rdan le an:",
    "keepSecret": "ğŸ¤« Daro i thurin!",
    "backButton": "Ego Ned ah Mindon"
  },
  "viewAdmin": {
    "title": "Cennen i Condir",
    "participantLinksTitle": "Thailen i Mellyn",
    "participantLinksHelp": "Anno i thailen hen an mellyn man anÃ­rach ned",
    "passwordLabel": "Tecco TÃªw i Condir",
    "passwordPlaceholder": "TÃªw i condir",
    "unlockButton": "Gwenn Hain Haded",
    "incorrectPassword": "TÃªw Ãº-certh",
    "allAssignmentsTitle": "Hain Haded Thurin MÃ­rdan",
    "giverColumn": "Anno",
    "receiverColumn": "Cabed",
    "backButton": "Ego Ned ah Mindon"
  },
  "error": {
    "title": "âš ï¸ Baw",
    "backButton": "Ego Ned ah Mindon"
  },
  "validation": {
    "minParticipants": "Orthach nelui mellyn an Thurin MÃ­rdan",
    "maxParticipants": "Canad mellyn anglenna (and thail anglenna)",
    "seedRequired": "Tecco had annui",
    "passwordRequired": "Tecco tÃªw i condir",
    "passwordTooShort": "TÃªw i condir orthach cÃ¢n rÃ®w",
    "noAssignmentFound": "Had an {name} Ãº-hÃ®r",
    "failedToLoad": "Ãš-cabed had hÃ®r: {error}",
    "failedToCreate": "Baw ego Thurin MÃ­rdan: {error}",
    "invalidUrl": "Thail Ãº-certh: mellon edh condir Ãº-hÃ®r",
    "invalidData": "Le anglenna Ãº-certh",
    "failedToCopy": "Ãš-cabed togo"
  },
  "alerts": {
    "viewInstructions": "An cennen le had, togo i thail annui i annen an le."
  }
}
